{
  "schema_version": 1,
  "status": "draft",
  "operation": "supplement_skill_creative_examples",
  "source_skill_id": "dawn-mist-aerial-real-estate",
  "generated_by": "Codex_DT",
  "provenance": {
    "benchmark_skill_ids": [
      "giant-ip-landmark-parade",
      "sci-fi-city-promo",
      "architectural-assembly-reveal"
    ],
    "benchmark_usage": "creative_quality_only",
    "contract_inference": false,
    "topic_rule_copying": false
  },
  "quality_rubric": {
    "dimensions": [
      "有序场景引用清晰",
      "晨曦云雾视觉主线统一",
      "硬切时间轴完整",
      "摄影机与环境动态分离",
      "建筑材质和空间纵深可见",
      "意象数量服从用户指令",
      "终局构图与停止状态明确"
    ],
    "assessment": "草稿以完整输入映射、逐段可执行描述和可审核的失败修复为质量目标。所有晨曦光色、丝滑平流雾、斜侧透视、沉稳运镜与硬切方法均来自当前 Skill 来源；基准 Skill 只用于检查正例、反例和边界案例是否完整，没有迁移其他题材规则，也没有改变素材契约。"
  },
  "outputs": {
    "positive_examples": [
      {
        "input_conditions": "示例意图为15秒、16:9的晨曦云雾地产地标短片。aerial-scene-frames 按顺序包含：图片1江畔建筑群宏观环境、图片2水面与雾带、图片3核心建筑玻璃立面斜侧视角、图片4单只白鹭近景、图片5建筑与江湾远景。用户明确只要单只白鹭，不要纱幔；核心建筑称为云湾中心。",
        "prompt": "画面比例16:9，视频时长15秒。参考绑定：图片1作为晨曦宏观起幅；图片2作为水面、雾带和飞行动线；图片3锁定云湾中心的玻璃幕墙、金属窗框与阳台纵深；图片4锁定单只白鹭的形态和近景方向；图片5作为建筑与江湾关系的终局构图。全片保持清晨暖金侧逆光，低空平流雾像薄纱和缓慢水流一样贴近江面与建筑腰部移动，建筑形体前后一致。画面只出现一只白鹭，不出现纱幔或其他飞鸟。相邻段落采用清晰硬切，每个镜头内部运动沉稳、克制。\n\n0-3秒：依据图片1，高空广角从江湾侧面缓慢平移，云湾中心位于画面中远景，建筑轮廓被晨曦勾出暖金边光。低空平流雾沿江面水平流动，在楼群之间形成薄而连续的层次，阳光穿过雾隙形成柔和光束；摄影机不俯冲，平移结束时核心建筑完整显露。\n\n3-5秒：画面直接硬切至图片2的水面高度。摄影机在水面上方缓慢跟随单只白鹭侧向滑翔，白鹭每次振翅都带出轻微羽毛抖动和下方水面气流纹理；金色碎光随波纹移动，远处薄雾继续贴水流淌。镜头保持稳定距离，不生成第二只飞鸟。\n\n5-9秒：画面直接硬切至图片3的云湾中心立面近景。摄影机以带夹角的斜侧透视缓慢横移，玻璃幕墙反射江面、晨光与流动雾带，同时清楚显出金属窗框厚度、阳台挑板和室内外空间层次。高光随摄影机移动沿玻璃表面连续游走，立面边缘保持笔直，建筑不拉伸、不弯曲；镜头结束时仍保留建筑侧面与前景立面的夹角。\n\n9-11秒：画面直接硬切至图片4的单只白鹭近景。摄影机以稳定长焦轻缓跟拍，白鹭迎着侧逆光完成一次舒展振翅，翼尖羽毛在光线下呈现半透明边缘，气流推动少量雾丝从其身后掠过。主体始终保持单只、完整且位于清晰焦点内。\n\n11-15秒：画面直接硬切至图片5的江湾远景。云湾中心稳定矗立在缓慢流动的金色雾海之上，摄影机平缓向后拉开少量距离，让江面、建筑群和天空形成完整三层纵深。单只白鹭从画面侧上方掠过后离开主体区域，晨光在建筑顶部形成克制星芒；雾、水和光继续缓慢运动，摄影机逐渐停止，在图片5对应的宏观关系和清晰天际线中稳定收束。\n\n整体约束：建筑、江湾和白鹭遵循各自参考身份；云雾保持轻薄、丝滑、贴地流动，不形成厚重块团；立面镜头使用斜侧透视并同时呈现反射与结构纵深；禁止参考图中的宣传字、标记线和图形包装进入三维场景；禁止叠化、遮挡式衔接、极速俯冲、甩镜、建筑穿模、垂直正对立面造成平面贴图感，以及擅自增加飞鸟或纱幔。",
        "why_it_works": "正例按有序素材逐段绑定宏观环境、水面、立面、意象和终局关系，摄影机运动与云雾、水面、飞鸟的主体运动分别描述。立面段写出视角、反射、窗框厚度和停止构图；每次硬切都清晰可执行，并严格服从用户对单只白鹭和无纱幔的要求。"
      }
    ],
    "negative_examples": [
      {
        "input_conditions": "参考图包含玻璃建筑、江面和飞鸟意象，但提示词只写抽象气氛，没有约束视角与物理动态。",
        "prompt": "镜头正对大楼，玻璃很闪，周围翻滚着巨大云海，很多鸟快速飞过，镜头高速俯冲并用叠化切到远景。",
        "reason": "该写法违背当前 Skill 的斜侧透视、丝滑平流雾、用户意象数量、沉稳运镜和硬切规则。可观察失败包括玻璃建筑变成二维反光贴片、云雾形成厚重块团、飞鸟数量失控、俯冲造成楼体扭曲，以及叠化时前后建筑粘连。",
        "correction": "将立面改为带夹角的斜侧横移，同时写出玻璃环境反射、窗框厚度和阳台纵深；把云雾描述为轻薄贴地的连续流体；锁定用户指定的意象数量；各场景直接硬切，镜头内部只使用缓慢平移、缓推或克制拉远。"
      },
      {
        "input_conditions": "参考图上带有楼盘宣传字和尺寸标线，提示词未说明如何处理二维包装。",
        "prompt": "完整还原参考图中的建筑、标题、价格文字和尺寸线，让所有内容在云海中一起动起来。",
        "reason": "文字和标线属于参考图的二维包装，不是建筑实体。可观察失败是宣传字被生成为悬浮招牌，尺寸线贴在立面或天空，破坏真实空间和高奢建筑摄影质感。",
        "correction": "只绑定参考图中的建筑体量、材质、环境和构图，明确忽略平面文字、标记线与界面图形；用真实幕墙、窗框、阳台、江面和雾带填充可见空间。"
      }
    ],
    "boundary_examples": [
      {
        "input_conditions": "有序参考图中某张既可能是普通场景参考，也可能被用户期待为严格结尾画面，但用户没有说明。",
        "boundary": "当前契约只确认它属于有序场景素材，不能自行把普通参考升级为严格尾帧关系；晨曦光色、沉稳镜头、硬切和身份一致性仍可使用。",
        "handling": "先暂停对最终一帧的精确承诺，向用户确认该图是用于场景构图参考，还是要求结尾严格到达其画面。确认前可描述以该图的建筑与环境关系收束，但停止声称最终像素构图或镜头状态与原图完全一致。",
        "why": "这避免把尚未确认的画面关系写成确定事实，同时保留已有素材能够支持的宏观收束方式。"
      },
      {
        "input_conditions": "用户明确要求阴天冷色、完全无飞鸟，并希望保留缓慢硬切的地产航拍结构。",
        "boundary": "用户当前光色和意象要求覆盖 Skill 的默认晨曦暖金与飞鸟经验；斜侧透视、建筑三维纵深、沉稳镜头、环境活化和硬切仍然适用。",
        "handling": "停止添加暖金晨曦、星芒和任何飞鸟，改用用户指定的冷色漫射天光；保持雾带轻薄流动，但使其亮度和色温服从阴天环境。继续用斜侧视角呈现玻璃反射、窗框厚度和阳台纵深，各段保持克制硬切。",
        "why": "用户明确指令优先，默认意象和光色可以降级；不冲突的空间与运动方法仍能维持该类地产地标视频的稳定性。"
      },
      {
        "input_conditions": "唯一参考图是建筑正面效果图，画面看不到侧面、阳台内部或周边环境。",
        "boundary": "可识别建筑正面身份和主要材质，但不足以可靠还原侧面体量、内部纵深和完整江湾关系。",
        "handling": "保留缓慢、克制的正面微幅视差和光影变化，停止编写大角度绕行、明确侧面结构或不存在的环境全景。向用户说明若要斜侧立面和宏观闭环，需要补充可观察相应空间关系的参考；若不补充，则把任务收束为当前正面构图内的轻微动态。",
        "why": "斜侧透视是防止二维化的方法，但不能在来源不可见时凭空发明建筑结构；降级运动幅度能保护身份一致性。"
      }
    ],
    "optional_creative_guidance": [
      "描述玻璃立面时同时写摄影机夹角、环境反射、结构厚度和内部空间，四者共同形成三维感，不能只写玻璃闪亮。",
      "环境活化应区分运动主体：雾带沿地形或水面流动，水面产生细碎波纹与移动反光，飞鸟产生振翅和气流；避免用笼统的自然变化代替。",
      "硬切只决定段落之间的连接方式；每个独立镜头仍需写清起始构图、摄影机速度、主体动态、光影反馈和结束构图。",
      "意象始终服从用户当次要求。用户指定单只、群体或完全不要时，应同步调整正文中的数量、运动和相关约束，不能沿用固定默认。"
    ]
  }
}
