{
  "schema_version": 1,
  "status": "draft",
  "operation": "supplement_skill_creative_examples",
  "source_skill_id": "city-real-estate-habitat-promo",
  "generated_by": "Codex_DT",
  "provenance": {
    "benchmark_skill_ids": [
      "giant-ip-landmark-parade",
      "sci-fi-city-promo",
      "architectural-assembly-reveal"
    ],
    "benchmark_usage": "creative_quality_only",
    "contract_inference": false,
    "topic_rule_copying": false
  },
  "quality_rubric": {
    "dimensions": [
      "素材槽与引用顺序一致",
      "全局视觉主线连续",
      "时间推进完整可执行",
      "摄影机运动与场景变化分离",
      "物理遮挡和空间到达可观察",
      "结尾构图与停止状态明确",
      "反例和边界处理可审核"
    ],
    "assessment": "草稿仅采用优秀 Skill 的完整度、可执行性和审核结构作为质量尺度；具体题材、视觉规则、转场方式与镜头意图均来自当前城市人居 Skill 的来源经验。正例覆盖输入条件、参考绑定、时间推进、摄影机路径、物理遮挡、社区平视和结尾机位；反例列出可观察失败与修正；边界案例明确保留项、停止项和处理方式。"
  },
  "outputs": {
    "positive_examples": [
      {
        "input_conditions": "示例意图为15秒、16:9的城市与地产人居宣传片。city-context 中的图片1是沿江城市天际线与唯一核心地标；real-estate-context 中的图片2是社区布局认知图、图片3是塔楼玻璃与金属立面、图片4是面向江景的弧形阳台。用户希望以暖金色未来城市气质开场，城市段为叙事主体，最后到达阳台视角。",
        "prompt": "画面比例16:9，视频时长15秒。参考绑定：图片1用于城市地标、江面与天际线；图片2只用于理解社区道路、水景和楼栋之间的空间关系，成片进入社区后采用地面附近的平视视角；图片3用于主塔楼立面材质与环绕上升路径；图片4用于最终阳台机位、透视方向和外部江景。全片保持暖金色未来人居美学，一条细腻的金色光流从城市水脉延伸至社区，作为连续视觉主线；核心地标只出现一个，楼栋形体、立面材质和阳台方向在前后镜头中保持一致。\n\n0-5秒：镜头从深色体积雾中的江面上方开始，以连续向前的S形弧线低空掠行。金色光流沿真实水面波纹向前延伸，逐步勾勒桥梁和城市道路，图片1中的核心地标在前方被暖光照亮。摄影机先贴近水面，再轻微抬升越过桥面边缘；江雾被气流推开，桥体与地标保持完整、不复制，运动方向始终朝向城市内部。\n\n5-10秒：摄影机继续沿江岸侧倾前进，从核心地标侧面掠过，保持建筑厚度与城市纵深。金色光流在街道和建筑底部继续向前，镜头避开正面穿透任何实体。接近城市与社区的连接处时，前方一座建筑的实体侧边由右向左自然遮满画面；遮挡结束后，镜头在同一前进方向切入图片2所示社区空间，机位降至树冠和首层架空层附近，以平视高度沿林荫步道与水景之间弧线穿行。树叶受风轻摆，水面反射移动光斑，楼栋位置依据图片2保持清晰关系，不出现社区俯瞰。\n\n10-13秒：摄影机保持向前势能接近图片3中的主塔楼，沿玻璃幕墙与金属饰边形成的弧面开始绕行上升。镜头与立面保持安全间距，先显出窗框厚度、阳台挑檐和玻璃中的城市反射，再顺着建筑轮廓逐层升高；建筑不弯曲，玻璃反射随视角连续移动，金色光流沿立面线条向上引导。\n\n13-15秒：环绕上升自然减速，摄影机准确到达图片4的弧形阳台拍摄位置。画面从立面边缘打开为完整江景与城市天际线，阳台栏杆、室内外边界和远处唯一地标构成稳定纵深。金色光流在远处江面收束，树叶和薄纱只保留轻微风动；摄影机停止平移与旋转，在图片4对应的三维透视机位稳定定格。\n\n整体约束：城市叙事占主要时段；摄影机保持连续向前深入，禁止突然后退或方向互相抵消；城市到社区只使用真实实体遮挡关系，不使用全屏渐变或叠化；社区段保持低空平视，不把图片2直接贴入画面；禁止复制核心地标、穿透墙体、楼体扭曲以及把图片4作为二维静态尾图。",
        "why_it_works": "该范例逐项绑定两个既有素材槽，区分布局认知、立面路径与结尾机位；时间线完整呈现城市主叙事、实体遮挡、社区平视、环绕上升和稳定到达。摄影机运动、环境反馈、建筑材质与停止状态均可观察，同时没有把示例中的城市、时长或图片数量写成通用要求。"
      }
    ],
    "negative_examples": [
      {
        "input_conditions": "同样使用城市天际线、社区布局、塔楼立面和阳台视角，但提示词只追求炫技，没有说明素材绑定和空间路径。",
        "prompt": "镜头快速冲过城市，楼盘鸟瞰图直接变成社区，然后自由穿过大楼，最后把阳台图片贴在画面上结束，加入炫酷渐变和来回推拉。",
        "reason": "该写法违反当前 Skill 的城市到人居空间逻辑：布局图被当成成片鸟瞰画面，摄影机前后方向冲突并穿透实体，二维渐变代替物理遮挡，结尾没有到达阳台机位。可观察失败包括楼盘像平面贴图、地标重复、建筑穿模、镜头方向跳变以及尾图突然冻结。",
        "correction": "先标明每张参考图的业务用途；保持摄影机持续向前，以建筑侧边真实遮满画面后进入社区；社区采用地面附近的平视弧线穿行；接近主楼后沿立面环绕上升，并在阳台参考图对应的三维摄影视点减速停止。"
      },
      {
        "input_conditions": "用户希望城市叙事自然过渡到社区，但提示词反复复制同一地标来制造规模感。",
        "prompt": "城市两侧出现多个完全相同的核心地标，镜头在这些地标之间高速左右摇摆，再突然俯视整个社区。",
        "reason": "复制标志建筑破坏城市身份唯一性，高速左右摇摆削弱单向深入的叙事，突然俯视也背离社区平视体验。可观察失败是天际线出现克隆建筑、空间方位无法判断、社区像规划沙盘而非可居住环境。",
        "correction": "保留唯一核心地标，以江河、桥梁、街道和光流扩展城市层次；摄影机用连续弧线或侧倾向前运动，进入社区后降低机位，让步道、水景、绿化和首层空间依次通过前中后景建立人居尺度。"
      }
    ],
    "boundary_examples": [
      {
        "input_conditions": "real-estate-context 中只有一张楼盘高位布局图，没有可确认的立面细节或阳台视角。",
        "boundary": "布局图仍可用于理解楼栋和道路关系，但来源不足以确定具体幕墙材质、环绕上升路线以及最终阳台机位。",
        "handling": "继续保留城市主叙事、单向深入、真实实体遮挡和社区平视等来源规则；停止具体立面材质复刻、精确阳台到达和对应尾景的写法。向用户说明当前能安全完成到社区平视漫游，并询问是否补充立面或阳台参考，或将结尾改为已确认的社区中景稳定停留。",
        "why": "这样既使用已有素材完成可验证部分，也不会凭空发明建筑细节或把高位布局图误当作最终画面。"
      },
      {
        "input_conditions": "用户给出完整可执行提示词，并明确要求使用硬切而不是城市到社区的实体遮挡衔接。",
        "boundary": "用户当前明确指令高于 Skill 的默认转场经验；素材身份、地标唯一性、社区平视和空间连续性仍需保持。",
        "handling": "保留用户的硬切安排，只做引用编号、时间边界和歧义术语的语义保持整理；停止添加实体遮挡衔接，不擅自改成一镜到底。若硬切后的社区机位方向无法从素材判断，保留该歧义并请求用户指定切入方向。",
        "why": "该处理尊重用户已经完成的创作决定，同时继续执行不与其冲突的身份和空间稳定规则。"
      }
    ],
    "optional_creative_guidance": [
      "将城市布局认知与成片机位分开：高位布局参考可决定楼栋、道路和水景关系，但社区成片镜头仍按用户意图和本 Skill 规则选择平视空间。",
      "编写实体遮挡时应写清遮挡物、进入画面的方向、何时遮满、遮挡后出现的空间以及摄影机前进方向，避免只写抽象的无缝衔接。",
      "结尾的机位到达需同时写出摄影机减速、最终位置、观看方向、可见前中后景和停止动作，避免把末张参考图处理成二维贴片。"
    ]
  }
}
