{
  "schema_version": 1,
  "status": "draft",
  "operation": "supplement_skill_creative_examples",
  "source_skill_id": "giant-3d-logo-landmark-video",
  "generated_by": "Codex_DT",
  "provenance": {
    "benchmark_skill_ids": [
      "giant-ip-landmark-parade",
      "sci-fi-city-promo",
      "architectural-assembly-reveal"
    ],
    "benchmark_usage": "creative_quality_only",
    "contract_inference": false,
    "topic_rule_copying": false
  },
  "quality_rubric": {
    "dimensions": [
      "输入条件与素材绑定完整",
      "主体身份与场景语义稳定",
      "时间推进和镜头动作可执行",
      "摄影机运动与Logo运动分离",
      "物理反馈与结束状态明确",
      "反例修正和边界处理可审计"
    ],
    "assessment": "正例覆盖输入、绑定、全局设定、逐段时间推进、摄影机与Logo独立动作、光影物理反馈和落幅条件；反例给出可观察失败及合格修正；边界案例明确继续适用规则、停止项与询问方式。内容仅实例化目标 Skill 已有规则，不新增素材槽或契约。"
  },
  "outputs": {
    "positive_examples": [
      {
        "input_conditions": "图片1为唯一3D Logo设定图；图片2、图片3、图片4依次为滨水广场、城市主街和山顶观景台场景参考。用户指定12秒、9:16，三段直接硬切；Logo在前两段保持静止，最后一段仅按画面坐标从右向左水平缓慢平移；不添加前景物体，环境保留轻微真实动态。",
        "prompt": "画面比例9:16，视频时长12秒。参考素材绑定：图片1作为3D Logo身份设定，锁定徽标轮廓、中文文字排列、字形、比例、厚度、金属材质、边缘倒角和正面朝向；图片2作为第一段滨水广场场景参考；图片3作为第二段城市主街场景参考；图片4作为第三段山顶观景台场景参考。三张场景图仅约束各自场景、构图、光照与空间关系，不作为严格起始帧或严格结束帧。全片保持同一个巨型Logo，禁止文字变形、笔画增减、徽标替换、厚度跳变、材质漂移、镜像翻转或复制出第二个主体。各段之间使用干净直接的硬切，不叠化、不渐变、不溶解；不添加树叶、建筑边缘或擦镜物体作为前景。\n\n0-4秒：完全依据图片2建立滨水广场的竖屏空间关系。摄影机从略低机位进行非常缓慢的直线后拉，逐步显露Logo与广场、岸线和远处建筑的尺度关系；Logo固定在原位，位置、尺度、朝向和姿态不变，不平移、不旋转、不缩放、不漂浮。水面细小波纹向岸边传播，远处行人以真实尺度缓慢移动，金属Logo边缘接收水面反光，地面投影稳定贴合接触位置。段末摄影机减速，Logo仍保持静止。\n\n4-8秒：画面直接硬切到图片3的城市主街。摄影机沿街道方向从左向右平稳侧移，以建筑透视线强化巨物尺度；Logo仍固定不动，禁止把摄影机侧移误写成Logo横移。车辆在安全距离外连续通过，路面反光随观察角度产生轻微变化，Logo投影方向与街区光源一致，遮挡关系稳定。段末保持Logo正面文字清晰可辨，摄影机缓停。\n\n8-12秒：画面直接硬切到图片4的山顶观景台。摄影机保持稳定的中远景，仅轻微向后拉远；Logo按照用户指定，从画面右侧向画面左侧沿纯水平直线缓慢平移，保持恒定高度、恒定尺度、恒定正面朝向，不向前后景深方向偏移，不旋转、不升降、不斜向移动。Logo经过观景台结构时，遮挡先后关系与投影同步移动，金属高光连续滑过倒角表面。10.8秒前抵达画面左侧指定位置，随后停止平移；最后一秒摄影机继续极轻微拉远，落在Logo完整、文字清楚、地标轮廓可辨的宏大全景，Logo静止结束。\n\n整体约束：摄影机动作与Logo动作分别执行；保持场景参考的建筑关系和光照逻辑；背景动态只用于维持现实感，不改变固定镜头意图。禁止新增拆解、组装、生长、飞行、抬升、环绕或未经要求的运动；禁止场景间出现半透明重叠。",
        "why_it_works": "素材编号和唯一语义明确，三段时间覆盖完整；前两段明确区分摄影机移动与Logo静止，末段用画面坐标限定Logo轨迹，并写出遮挡、投影、高光、停止时刻和最终构图，能直接执行且不改变契约。"
      },
      {
        "input_conditions": "图片1为3D Logo设定图，图片2为用户指定的严格起始帧城市广场，图片3为用户指定的严格结束帧夜景天际线。用户指定10秒、16:9，要求单一连续镜头，Logo自身保持静止，仅摄影机完成从起始构图到结束构图的空间过渡。",
        "prompt": "画面比例16:9，视频时长10秒。图片1用于锁定唯一3D Logo的徽标、文字、排列、比例、厚度、材质和朝向；图片2是严格起始帧；图片3是严格结束帧。第一帧逐项对齐图片2的广场构图、Logo位置与尺度、建筑关系、景别、光照和透视。Logo全程固定在空间坐标中，不平移、不旋转、不缩放、不漂移、不改变朝向。0-3秒，摄影机从图片2构图开始沿平滑弧线缓慢侧移并略微抬高，Logo保持静止，近处地面纹理产生合理视差，投影牢固贴合地面。3-7秒，摄影机继续穿过开放空间，环境光由暖色日落逐步过渡到城市灯光初亮；变化发生在天空与环境照明中，Logo的几何和材质不变，金属表面只响应周围光源。7-10秒，摄影机减速进入图片3的目标机位，逐项收敛到图片3的Logo位置与尺度、天际线关系、景别、夜景光照和透视；9.5秒前完成对齐，最后半秒完全稳定，最后一帧严格匹配图片3。禁止硬切、叠化和凭空变形，禁止将环境光变化解释为Logo材质变化。",
        "why_it_works": "该案例只在用户明确指定时使用严格首尾帧语义，明确了首帧、过渡、收敛和尾帧逐项对齐要求，同时保持Logo静止并把所有空间变化归于摄影机。"
      }
    ],
    "negative_examples": [
      {
        "input_conditions": "图片1为Logo设定，图片2和图片3是普通场景参考；用户要求Logo静止、两场景直接硬切。",
        "prompt": "Logo在城市里自由飞行并旋转，镜头环绕Logo，树叶不断擦过镜头，画面自然过渡到下一座城市，最后Logo逐渐变成图片3的样子。",
        "reason": "擅自加入飞行、旋转、环绕和前景；把普通场景参考误当成形变目标；“自然过渡”会导致叠化或语义不明；摄影机与Logo运动没有分开，直接违反用户的静止要求和场景唯一语义。可观察结果是Logo身份漂移、文字变形、场景半透明混合以及主体无故移动。",
        "correction": "写明图片2、图片3仅为各段场景参考；两段之间直接硬切。逐段分别描述摄影机轨迹和Logo状态，明确Logo不平移、不旋转、不缩放、不漂移；删除所有未被要求的前景、飞行、环绕和形变，并以清晰静止落幅结束。"
      },
      {
        "input_conditions": "用户指定图片3为严格结束帧，并要求Logo从右向左水平移动后停住。",
        "prompt": "Logo缓慢向左移动，镜头跟随，最后大致接近图片3并自然停下。",
        "reason": "运动方向缺少画面坐标和禁止偏移项；“大致接近”不足以执行严格结束帧；没有规定Logo尺度、朝向、建筑关系、景别、光照、透视和停止时刻。结果可能出现斜向漂移、前后景深移动、尾帧构图偏差或尚未到位就结束。",
        "correction": "改为Logo从画面右侧向画面左侧沿纯水平直线缓慢平移，恒定高度、尺度和朝向，不向景深方向偏移；在结束前抵达目标位置并停止。最后一帧逐项对齐图片3的构图、Logo位置与尺度、建筑关系、景别、光照和透视。"
      }
    ],
    "boundary_examples": [
      {
        "input_conditions": "用户只上传一张地标图，但同时称它为“场景参考”和“最后一帧必须完全一样”，两种语义存在冲突。",
        "boundary": "同一素材的普通场景约束与严格结束帧约束不能在未澄清时自动并存，否则结尾精确对齐义务不明确。",
        "handling": "继续适用Logo身份锁定、素材顺序和用户指令最高优先级；暂停撰写最终时间轴，不推断该图的唯一语义。向用户只询问一个必要问题：该图是仅供场景参考，还是必须作为严格结束帧；确认后按唯一语义写作。",
        "why": "这样保留用户原意并避免将普通参考擅自升级为帧约束，也不会改变契约中允许用户指定场景语义的范围。"
      },
      {
        "input_conditions": "用户提供了完整可执行提示词，明确要求Logo旋转展示，而 Skill 的常见写法倾向于保持朝向稳定。",
        "boundary": "用户当前明确动作覆盖默认的静止或稳定朝向建议，但Logo身份、文字结构、厚度和材质仍需稳定。",
        "handling": "保留用户指定的旋转方向、角度范围和节奏，只做语义不变的清理；停止加入“禁止旋转”这类被覆盖的旧约束。仍分别描述摄影机与Logo动作，并补足旋转后的停止朝向、文字可辨性和最终构图。",
        "why": "用户指令优先级最高；去除冲突负面约束可避免同一提示词同时要求旋转与禁止旋转，同时不放弃Logo身份连续性。"
      }
    ],
    "optional_creative_guidance": [
      "先为每张场景图声明唯一语义：普通场景参考、严格起始帧或严格结束帧；未明确时不自行升级。",
      "每个时间段至少分别写出摄影机动作、Logo动作或静止状态、环境动态、光影或遮挡反馈以及段末状态。",
      "Logo移动使用画面坐标、轨迹形状、速度趋势、恒定项、禁止偏移项和停止位置共同限定。",
      "严格结束帧应逐项核对构图、Logo位置与尺度、建筑关系、景别、光照和透视，并预留到位后的稳定时间。",
      "负面约束只保留当前有效要求的反面；用户取消或覆盖的旧要求不得以否定句残留。"
    ]
  }
}
