{
  "schema_version": 1,
  "status": "draft",
  "operation": "supplement_skill_creative_examples",
  "source_skill_id": "sci-fi-city-promo",
  "generated_by": "Codex_DT",
  "provenance": {
    "benchmark_skill_ids": [
      "sci-fi-city-promo",
      "giant-ip-landmark-parade",
      "architectural-assembly-reveal"
    ],
    "benchmark_usage": "creative_quality_only",
    "contract_inference": false,
    "topic_rule_copying": false
  },
  "quality_rubric": {
    "dimensions": [
      "输入意图与参考绑定",
      "城市视觉主线",
      "地标识别与文化视觉化",
      "时间推进与空间衔接",
      "摄影机和环境动作",
      "结尾主题构图",
      "反例与边界可审计性"
    ],
    "assessment": "正例按有序城市视觉参考建立从自然水脉、现代地标到文化空间和城市全景的连续叙事，明确每段摄影机路径、地标材质变化、环境反馈与收尾状态；反例说明地标堆砌、空泛形容和生硬转场的可观察后果及改写方向；边界案例区分可继续使用的参考绑定规则与必须停止的地理或地标猜测。基准仅衡量范例完整度，没有复制其他题材规则。"
  },
  "outputs": {
    "positive_examples": [
      {
        "input_conditions": "示例意图：制作15秒竖版临川市科幻城市形象短片，主题为“水脉连接古今，创新照向未来”。city-visual-references 按序绑定图1临川河湾与城市天际线、图2弧形玻璃文化中心、图3青砖木构历史街区、图4跨河桥梁与夜景道路。观察记录确认图1有河面晨雾与远处楼群，图2有银灰金属肋和蓝色玻璃幕墙，图3有青砖墙、木窗与坡屋顶，图4有桥梁结构、车流光迹与滨水高楼。用户指定银蓝数据水流作为贯穿视觉主线，不在画面内生成清晰口号文字。",
        "prompt": "【视频提示词】\n\n画面比例：9:16　视频时长：15秒。\n\n参考绑定：图1用于建立临川河湾、晨雾和城市天际线；图2用于锁定弧形玻璃文化中心的轮廓、银灰金属肋与蓝色幕墙；图3用于锁定青砖木构历史街区的屋顶、墙面和街巷尺度；图4用于建立跨河桥梁、滨水高楼与道路夜景。全片以银蓝数据水流为唯一视觉主线，把河流纹理、现代建筑曲线、传统窗棂纹样和桥梁道路光迹连接成“水脉唤醒城市”的连续叙事；各地标核心轮廓保持可辨认，科技效果附着于真实结构，不取代建筑本身。\n\n0-3秒：画面从图1河面暗部的近距离水波开始，银蓝微光沿真实水纹缓慢汇聚，形成细密数据水流。摄影机贴近河面向前滑行，水流从画面下方延伸到远处河湾，晨雾被光线照出层次，城市天际线从雾后逐渐显现；楼群只出现轻微窗光响应，不改变原有轮廓。银蓝水流沿岸线向右弯曲，引导摄影机靠近城市。\n\n3-7秒：摄影机沿银蓝水流快速掠过河岸，水流攀上图2文化中心的弧形外墙，并沿银灰金属肋自下而上游走。文化中心先显现贴合结构的稀疏线框，随后恢复为真实蓝色玻璃与银灰金属材质；玻璃反射河面和天空，金属肋出现连续窄高光。摄影机向上推进并绕建筑右侧缓慢抬升，始终保持弧形轮廓清晰，银蓝水流从建筑顶部越过画面，牵引下一段空间。\n\n7-11秒：摄影机穿过文化中心顶部被银蓝微光照亮的一层薄雾，光流形态从弧形建筑线条收束为图3木窗格纹样，空间连续进入历史街区。摄影机降低高度沿青砖街巷向前推进，银蓝光只沿木窗、青砖接缝和坡屋顶边缘温和流动，不把古建替换成金属结构；青砖保持粗糙漫反射，木窗保留温暖棕色，檐下灯光在湿润石板路上形成短反射。光流从屋檐末端落向街巷尽头的水面倒影，历史材质与未来能量形成清晰对照。\n\n11-15秒：摄影机沿倒影中的银蓝水流加速前进，穿出街巷后贴近图4桥面上升，桥梁结构、滨水高楼和道路光迹进入同一纵向构图。银蓝水流沿桥梁主结构向远处延伸，再与道路车流光迹和河岸灯光汇合；摄影机持续抬升，图1的河湾走向、图2文化中心的弧形轮廓、图3街区屋顶和图4桥梁关系以城市主题画卷的方式进入同一视野。最后一秒摄影机停止抬升，银蓝水脉在河面形成稳定的城市连接线，天际线与桥梁保持清晰，画面在黎明蓝调与暖色城市灯光的平衡中定格，形成“水脉连接古今，创新照向未来”的主题感收尾，不生成大段文字。\n\n整体约束：保持参考地标的核心轮廓、材质和地方特征；每段只承担一个主要叙事任务；银蓝数据水流负责空间连接，不得遮挡建筑主体；不得随机加入未确认的城市地标；不得用生硬跳切代替水面、薄雾、结构纹样与道路光迹的连续过渡；人物与车辆只作为远景尺度和环境动势，不喧宾夺主。",
        "why_it_works": "该范例完全沿用既有的有序参考绑定，也未把示例城市变成通用要求。统一的银蓝数据水流同时承担叙事、转场和文化连接功能；现代建筑与历史街区保留各自真实材质，科技效果附着于可见结构。每段明确摄影机方向、环境变化和叙事任务，结尾把河湾、文化中心、古街与桥梁组织为可辨认的城市整体画面。"
      }
    ],
    "negative_examples": [
      {
        "input_conditions": "使用四张按序城市参考图，用户希望表现城市的现代建筑、历史文化、河流与桥梁，并要求具有连续科幻视觉叙事。",
        "prompt": "这座城市非常高级、宏大、未来、震撼。画面依次出现城市塔、古庙、雪山、海港和太空电梯，然后切换到文化中心，再切换到老街，最后出现清晰城市口号。所有建筑都变成霓虹金属，加入大量粒子和飞行汽车。",
        "reason": "可观察失败是参考图中的真实地标被未确认元素替代，城市气质被空泛形容词和通用科幻符号淹没，现代与历史空间之间只有生硬切换，建筑材质与核心轮廓失真，清晰文字还可能破坏收尾画面。它违反了有序参考绑定、地标识别、统一视觉主线、文化视觉化和连续空间衔接规则。",
        "correction": "先从每张参考图提取真实可见的水体、建筑轮廓、文化纹样与道路结构，再选择一种与用户主题一致的视觉主线贯穿全片；用水面倒影、结构线条、雾层或道路光迹把相邻空间连接起来；分别写清摄影机路径和环境响应；科技效果只强化真实地标，不随机增添异地符号；结尾以城市整体构图表达口号主题，文字留给后期处理。"
      }
    ],
    "boundary_examples": [
      {
        "input_conditions": "city-visual-references 的图1至图3顺序明确，但用户没有说明城市名称；图中一座塔形建筑与两座城市的知名地标外观相似，历史街区的地域纹样也无法从画面可靠确认。",
        "boundary": "参考素材的有序绑定、地标核心轮廓保护、统一视觉主线和连续转场仍然适用；城市身份、地标专名、地方文化寓意以及不在画面中的地理关系必须停止推断。不能因相似外观就把建筑命名为某个城市地标，也不能自行补入城市口号。",
        "handling": "向用户确认城市名称、相似塔形建筑的正式名称，以及希望强调的地方文化关键词。确认前可用“图1塔形建筑”“图2滨水公共建筑”“图3历史街区”等中性称谓整理镜头结构，并只描述画面可见的轮廓、材质、水体与道路；若用户要求立即保留现有完整提示词，则只修正编号、顺序和明显格式问题，不擅自加入新的视觉主线或文化解释。",
        "why": "城市宣传片的识别度依赖正确的城市身份和文化语义。该处理继续使用来源能够确认的画面事实与叙事规则，同时把命名和文化解释交还用户，避免错误地标、错误城市和虚构文化信息进入最终范例。"
      }
    ],
    "optional_creative_guidance": [
      "视觉主线应同时承担三项具体功能：从上一场景带出运动方向、附着于下一地标的真实结构、在结尾汇聚为城市整体关系；若只作为装饰粒子出现，就不能形成有效叙事。",
      "城市文化表达应从参考图中可见的材质、纹样、街巷尺度、水系或地貌出发，把抽象文化关键词转换为可拍摄变化，避免用形容词替代画面。",
      "一镜到底不是无限叠加运动。每个时段只安排一个核心画面任务，摄影机路径服务于地标揭示和空间衔接，结尾应留出稳定构图时间。"
    ]
  }
}
