{
  "schema_version": 1,
  "status": "draft",
  "operation": "supplement_skill_creative_examples",
  "source_skill_id": "architectural-assembly-reveal",
  "generated_by": "Codex_DT",
  "provenance": {
    "benchmark_skill_ids": [
      "architectural-assembly-reveal",
      "giant-ip-landmark-parade",
      "sci-fi-city-promo"
    ],
    "benchmark_usage": "creative_quality_only",
    "contract_inference": false,
    "topic_rule_copying": false
  },
  "quality_rubric": {
    "dimensions": [
      "输入条件与参考绑定",
      "全局视觉与主体连续性",
      "时间推进与镜头动作",
      "构件轨迹与物理结果",
      "绝对尾帧与结尾状态",
      "反例可诊断性",
      "边界处理完整性"
    ],
    "assessment": "正例逐段绑定有序建筑尾帧，分别写明摄影机运动、构件动作、接触结果与停止状态，并让每段最后一刻准确抵达对应参考构图；反例包含可观察失败、违反规则和合格修正；边界案例明确保留项、停止项与询问方式。基准只用于结构完整度和可审计性，未迁移其他题材的镜头内容或素材规则。"
  },
  "outputs": {
    "positive_examples": [
      {
        "input_conditions": "示例意图：制作15秒横版建筑特写至全貌动态组装展示。assembly-frames 中有序绑定图1石材入口节点、图2露台玻璃栏板与金属檐口、图3建筑全貌；三张图均作为各自段落最后一刻的绝对尾帧。观察记录确认图1可见浅灰石材墙板、深色门框和墙槽，图2可见玻璃栏板、金属连接件、悬挑檐口与树影，图3可见完整立面、屋顶挑檐、庭院铺地和远处树冠。用户要求从构造细节逐步揭示完整建筑，保持真实材质与克制动作。",
        "prompt": "【视频提示词】\n\n画面比例：16:9　视频时长：15秒。\n\n参考绑定：图1对应0-5秒并作为该段最后一刻的绝对尾帧；图2对应5-10秒并作为该段最后一刻的绝对尾帧；图3对应10-15秒并作为该段最后一刻的绝对尾帧。全片从入口构造特写逐步扩展至露台关系和建筑全貌，浅灰石材、深色金属、透明玻璃与庭院铺地保持连续；只驱动参考画面中真实可见的关键构件，所有装配动作先完成锁定，摄影机随后收束到对应尾帧。\n\n0-5秒：画面以浅灰石材墙板和深色门框的近距离失焦轮廓开场。起幅阶段，摄影机从低机位快速向前推进并向右平移，焦点由前景石材边缘转移到门框与墙槽的连接线。左侧一块可见石材墙板从画面左前方沿水平轨迹靠近门框，板侧连接边先进入墙槽，随后整块墙板向内压合；接触后原本外露的缝隙被石材边缘遮住，门框旁形成稳定窄阴影，墙板停止且不再漂移。中段摄影机保持水平视角缓慢向右平移，焦点锁定已经闭合的接缝，石材维持粗糙漫反射，深色门框出现窄幅高光滑动。落幅阶段继续沿向右平移轴快速收束，组装状态保持锁定，最后一刻准确抵达图1的入口节点机位、构图、遮挡与光照。\n\n5-10秒：承接上一段向右运动，摄影机从玻璃栏板前缘快速向右推进并顺时针绕向露台外侧，焦点迅速落到玻璃栏板底部的金属连接件。玻璃栏板从画面左后方沿右前方斜向轨迹接近基座，底部连接件先对准孔位并插入，玻璃边缘随后缓慢回正；金属檐口沿墙体收口方向压合到位，遮住上方接缝。玻璃在回正过程中带动环境反射平稳移动，接触完成后栏板轻微下沉并停止，石材地面出现清晰而稳定的栏板投影。中段摄影机保持水平高度缓慢向右平移并继续顺时针微旋，焦点始终锁定连接处；背景中真实可见的树叶向右轻摆。落幅阶段沿相同向右轴和顺时针方向快速收束，在所有构件静止后，于最后一刻准确抵达图2的露台构图、反射、树影和光照。\n\n10-15秒：继续延续向右运动，摄影机从庭院铺地近景快速向右推进并缓慢抬升，焦点先锁定建筑立面右侧的屋顶挑檐。挑檐末端从画面右上方沿左下方短促斜向轨迹靠近屋面连接位，内侧金属节点先插入框架，外缘随后压合并遮住屋面收口缝；接触后窄幅高光沿深色金属边缘移动，挑檐受重力轻微下沉后完全停止。摄影机在中段保持平稳向右移动并继续抬升，焦点从挑檐连接处过渡到完整建筑轮廓，庭院铺地、入口、露台和屋顶关系依次进入清晰范围，远处真实可见的树冠轻微摆动。落幅阶段沿同一向右推进轴快速抬升收束，所有结构保持锁定，最后一刻准确抵达图3的建筑全貌机位、完整立面构图、庭院前景与光影状态。\n\n整体约束：不得让全部构件同时飞向中心；不得凭空增加家具、栏板或装饰；不得把推进、平移、环绕写成未选定动作菜单；不得在抵达参考图后继续移动；不得改变石材、金属和玻璃的真实材质关系。结尾保持建筑全貌稳定，构件无漂移、无回弹、无穿插，画面停在图3对应构图。",
        "why_it_works": "该范例没有新增素材要求，完整使用唯一有序槽并逐图声明尾帧角色；每段都把摄影机运动与构件运动分开，写清构件起点、目标、轨迹、接触顺序、遮挡或光影结果以及停止状态。相邻段延续向右运动，形成从特写到全貌的空间推进，同时每段先锁定装配再抵达绝对尾帧，符合目标 Skill 的核心方法。"
      }
    ],
    "negative_examples": [
      {
        "input_conditions": "同样使用三张按序建筑参考图，用户要求从入口节点展示到建筑全貌，每张图是对应段落的最终构图。",
        "prompt": "0-5秒，建筑零件从四面八方自然飞来并自动拼好，镜头根据画面选择推进、环绕或拉远。5-10秒，重复上述动作，加入一些家具让画面更丰富。10-15秒，所有部件同时向中心聚合，镜头先到达图3，再继续冲向天空形成震撼结尾。",
        "reason": "失败表现包括构件同速群飞、装配路径不可理解、摄影机动作未被选定、纯建筑画面凭空出现家具，以及抵达尾帧后继续移出参考构图。它违反了具体构件与目标位置绑定、唯一镜头路径、只使用可见对象、装配先后顺序和绝对尾帧停止条件，生成结果容易穿插、漂浮、比例变化并丢失参考构图。",
        "correction": "逐段点名参考图中可见的少量关键构件，分别写出其起点、运动方向、连接目标、先后接触和锁定结果；为每段选定唯一的起幅、中段和落幅镜头路径；只在观察记录确认存在时描写家具或道具；所有动作先停止，摄影机再沿既定方向收束，并在最后一刻准确停在对应参考图。"
      }
    ],
    "boundary_examples": [
      {
        "input_conditions": "assembly-frames 中图1与图2的顺序明确，但观察记录只能确认完整建筑外观，无法辨认哪些构件可拆卸、连接槽位在哪里，也无法确定画面中的桌椅是否属于固定陈设。",
        "boundary": "有序绑定和绝对尾帧规则仍然适用；不得因题材是建筑组装就自行指定墙板、连接件、家具或装配孔位。具体组装轨迹、接触顺序和家具降落做法应暂停，因为它们缺少可见证据。",
        "handling": "先向用户索要更清晰的节点图、构件说明或对可动部件的文字标注，并逐图确认允许运动的对象。信息补齐前只可整理已确认的参考顺序、尾帧关系、材质观察与摄影机收束方向，不输出含虚构装配动作的最终提示词。若用户明确要求保持建筑完全静止，则取消构件组装，只保留不改变主体结构的镜头揭示，并明确每段仍停在对应尾帧。",
        "why": "该处理保留了来源可确定的顺序、观察和尾帧规则，同时停止对构件身份与装配关系的猜测；用户当前明确指令仍具有最高优先级，也避免把示例中的石材、栏板或家具迁移到并不相符的建筑画面。"
      }
    ],
    "optional_creative_guidance": [
      "编写每段前先形成可审计的内部链条：可见构件—装配目标—运动轨迹—接触顺序—可见结果—停止状态—绝对尾帧；链条任一环缺少观察依据时，应暂停该动作并向用户确认。",
      "摄影机运动与构件运动应使用两个独立句群表达，避免读者无法判断是镜头移动还是建筑部件移动。",
      "多图段落之间只延续来源已经允许的运动方向；延续性用于空间衔接，不得覆盖每张参考图独立的绝对尾帧。"
    ]
  }
}
