{
  "schema_version": 1,
  "status": "draft",
  "operation": "supplement_skill_creative_examples",
  "source_skill_id": "giant-ip-landmark-parade",
  "generated_by": "Codex_DT",
  "provenance": {
    "benchmark_skill_ids": [
      "giant-ip-landmark-parade",
      "sci-fi-city-promo",
      "architectural-assembly-reveal"
    ],
    "benchmark_usage": "creative_quality_only",
    "contract_inference": false,
    "topic_rule_copying": false
  },
  "quality_rubric": {
    "dimensions": [
      "输入条件与素材绑定完整",
      "角色身份和场景顺序稳定",
      "时间轴与硬切节奏明确",
      "角色表演覆盖面部四肢和躯干",
      "道具及环境物理反馈可见",
      "反例修正和边界处理可审计"
    ],
    "assessment": "正例在目标 Skill 已有巨型IP巡游语义内，完整描述素材绑定、全局视觉、逐段硬切、摄影机动作、角色化表演、道具受力、背景活化和最终落幅；反例说明失败表现与修正；边界案例不猜测素材或动作。未新增契约要求。"
  },
  "outputs": {
    "positive_examples": [
      {
        "input_conditions": "图片1为圆润小熊IP四视图，固定奶油色短绒、蓝色背带包、圆耳和短肢比例；图片2、图片3、图片4依次为滨江步道、老城钟楼广场、山谷观景桥实景合成参考。用户指定12秒、9:16、三场景直接硬切，整体轻松欢乐，保留参考图中的实体道具，忽略平面字幕和贴纸。",
        "prompt": "画面比例9:16，视频时长12秒。参考素材绑定：图片1作为唯一IP角色身份参考，锁定奶油色短绒、圆耳、短肢、面部比例、蓝色背带包及整体材质；图片2作为第一段滨江步道参考，图片3作为第二段老城钟楼广场参考，图片4作为第三段山谷观景桥参考，场景顺序不得重排。忽略场景图中的平面字幕、边框和贴纸，只保留真实三维空间、角色与实体道具。全片为真实地标环境与高精度3D卡通角色融合，保持同一个巨型小熊，不复制、不换色、不改变脸型和服装。每段之间直接硬切，背景保持真实流动，角色动作具有清晰情绪、重心和物理结果，不使用仅呼吸或轻微摇晃的闲置表演。\n\n0-4秒：依据图片2展现滨江步道。摄影机以低机位广角沿步道平稳向前推进，江面波纹持续拍向岸边，远处骑行者和行人按真实尺度经过。巨型小熊先惊喜地睁大双眼，身体重心迅速前倾，两只短爪连续向江面兴奋挥动；它随后用力跺下右脚，圆润腹部与脸颊产生一次延迟回弹，蓝色背带包受惯性向上弹起后砸回背部，肩带被重量拉紧。脚掌接触地面时附近细小落叶向外散开，投影与脚底接触稳定。段末小熊抓稳肩带，笑着望向镜头。\n\n4-8秒：画面直接硬切到图片3的钟楼广场。摄影机从左向右侧移，广场游客继续行走，旗帜受风连续摆动。小熊大步绕着钟楼前的开放区域行进，每一步都先落脚、压低躯干、再由腿部发力抬升，短绒和腹部出现节奏明确的挤压与拉伸；它忽然听见钟声，耳朵快速竖起，头部猛然转向钟楼，双爪慌忙按住被阵风掀起的背带包翻盖。翻盖被风向后拉开，肩带绷紧，小熊向反方向压低身体抵抗风力，最终重新扣住翻盖。段末它松一口气，抹额头并向广场人群挥手。\n\n8-12秒：画面直接硬切到图片4的山谷观景桥。摄影机与桥面平行缓慢后拉，远处云影掠过山体，桥边旗带沿风向连续翻卷。小熊双爪握住桥边固定的望远镜实体把手，先踮脚再用力向下压住身体，探头观察山谷；望远镜支架在受力后轻微回弹但底座保持固定。它看到远处景色后兴奋得双眼发亮，松开一只爪子大幅指向山谷，另一只爪子继续抓牢把手，身体因失去平衡向侧面倾斜，蓝色背带包向相反方向甩动并把它拉回。小熊连续倒退两小步重新站稳，腹部和背包完成最后一次衰减回弹。摄影机拉远到宏大全景，最后一秒小熊站在桥中央高举双爪欢呼，角色轮廓、地标和山谷层次清晰，动作完成后稳定落幅。\n\n整体约束：角色表演覆盖眼神、耳朵、头部、四肢、躯干和重心变化；实体道具遵循重力、惯性、风力和连接关系；背景行人、水面、旗帜与云影保持适度真实动态。禁止平面文字或贴纸进入三维空间，禁止角色仅做微弱呼吸，禁止背包无受力悬浮，禁止重复主体、穿模、比例突变及硬切之间的半透明叠化。",
        "why_it_works": "三张场景按契约顺序绑定，逐段都有摄影机、角色复合表演、背景动态、道具受力、接触结果和段末状态；最后明确落幅。动作夸张但因果清楚，且只忽略平面包装，不删除实体道具。"
      },
      {
        "input_conditions": "图片1为带长围巾的企鹅IP设定图；图片2为雪原车站，图片3为海港广场。用户指定8秒、16:9、两段硬切，要求突出围巾的风力反馈和角色笨拙喜剧感。",
        "prompt": "画面比例16:9，视频时长8秒。图片1锁定唯一企鹅IP的黑白配色、橙色喙、短翅、圆滚身体和红色长围巾；图片2、图片3依次绑定雪原车站和海港广场。忽略参考图中的平面说明文字，只保留实体建筑、地面、围巾和环境物件。0-4秒，摄影机贴近雪面低位跟随企鹅向车站奔跑。企鹅两只短翅用力前后划动，双脚快速交替踩入积雪，身体每次落地都先压扁再弹起，喙张开急促喘气；红围巾被迎面风拉成向后翻卷的长弧，末端连续抽打空气，颈部连接处始终牢固。企鹅踩中松雪后向前滑行，双翅猛张保持平衡，雪粉沿运动方向喷散，最后用脚跟压入雪面停住。4-8秒，画面直接硬切到海港广场。摄影机侧向平移，背景游客行走、海水起伏、系泊绳随浪收紧放松。企鹅迎着侧风艰难前进，身体向风来的方向压低，双翅交替抓住围巾；一阵强风将围巾末端掀过头顶遮住双眼，它立刻停步、左右甩头、用两翅把围巾拉回胸前，圆润身体因急停产生一次向前挤压和两次衰减回弹。最后摄影机缓慢拉远，企鹅抱紧围巾站稳，抬头对镜头露出得意表情，海港地标与角色完整入画。禁止围巾脱离颈部、反向飘动或穿过身体，禁止企鹅滑行时脚底无接触，禁止背景静止和场景叠化。",
        "why_it_works": "该例围绕用户要求集中设计风力、布料连接、滑行接触和急停回弹，角色面部、翅膀、双脚与躯干协同表演；两段硬切和最终稳定状态清晰。"
      }
    ],
    "negative_examples": [
      {
        "input_conditions": "图片1是带背包的IP设定，图片2和图片3为有行人与车流的地标场景，用户要求活泼巡游和直接硬切。",
        "prompt": "巨型IP站在地标旁，微微呼吸，手臂轻轻摆动，背包自然晃动。背景保持参考图，镜头慢慢移动，然后自然切换到下一个场景。",
        "reason": "角色只有闲置微动，没有情绪、重心、四肢和躯干的角色化表演；“自然晃动”没有道具受力因果；“背景保持参考图”可能令行人车流冻结；“自然切换”没有落实直接硬切。可观察结果是角色像塑料雕塑、背包悬浮、背景像静态照片、转场出现叠化。",
        "correction": "为每段指定明确情绪目标和复合动作，写出面部、头部、四肢、躯干及重心的先后变化；说明背包受步伐惯性或风力拉扯、肩带绷紧和回弹结果；选择场景内真实可动元素进行适度活化，并在段首明确画面直接硬切。"
      },
      {
        "input_conditions": "场景图带有平面宣传字和一个角色手持的实体旗帜，用户要求保留旗帜互动。",
        "prompt": "删除画面中全部文字、Logo、贴纸和旗帜，IP疯狂挥舞，所有物体剧烈弹跳。",
        "reason": "把应忽略的平面包装与用户要求保留的实体旗帜混为一谈；“疯狂挥舞”和“所有物体剧烈弹跳”缺乏动作主体、受力方向、连接关系和停止状态，可能删除关键道具并产生无因物理。",
        "correction": "仅忽略平面宣传字、边框和贴纸，明确实体旗帜保留。描述IP双爪握住旗杆的位置、挥动轨迹、布面受风方向、旗杆惯性对手臂和躯干的反作用，并写出挥舞结束后旗面逐渐衰减、角色站稳的状态。"
      }
    ],
    "boundary_examples": [
      {
        "input_conditions": "用户提供的IP设定图中有固定帽子，但某张场景参考里的同一角色没有帽子，且用户未说明是否允许造型变化。",
        "boundary": "身份素材与场景参考在关键配饰上冲突，不能根据单张场景图自行决定删除或新增帽子。",
        "handling": "继续适用角色主体比例、材质、场景顺序和用户指令优先级；暂停帽子相关动作设计，向用户询问该帽子是否必须全片保留。确认保留时，以图片1身份为准并让帽子参与风力或惯性反馈；确认可移除时，再限定从哪一段开始改变，避免无因跳变。",
        "why": "帽子属于可识别身份与道具连续性要素，澄清后再写可防止角色漂移，也不会让示例反向改变契约。"
      },
      {
        "input_conditions": "用户明确要求某一段IP安静地凝望纪念地标，不希望夸张喜剧动作，而 Skill 通常强调高动态角色表演。",
        "boundary": "用户的克制情绪要求覆盖默认的高强度动作倾向，但不能退化为无意义的呼吸微动或完全没有可见意图。",
        "handling": "停止大幅挥舞、跳跃和喜剧性挤压拉伸；保留角色身份、真实背景动态、道具物理和清晰表演意图。改用可观察的克制动作链：缓慢停步、身体重心落稳、双爪在胸前握紧、抬头凝视、耳朵或眼神响应环境声，衣物在风中按连接关系摆动，最后保持庄重构图。",
        "why": "这既遵守用户最高优先级，也保留角色表演的因果与可见性，避免把“克制”误写成僵硬待机。"
      },
      {
        "input_conditions": "用户只提供一张场景参考并要求短片，但没有说明是否需要多场景巡游或如何转场。",
        "boundary": "契约允许一张或多张有序场景参考，不能为了套用多场景范例而虚构额外地点或素材。",
        "handling": "使用现有单一场景设计完整的起承转合：亮相、互动、物理反馈和落幅；停止使用硬切到其他地点的默认写法，不新增未提供场景。若用户明确希望多地点巡游，再请其补充相应场景素材。",
        "why": "这样尊重实际素材数量和用户意图，同时仍能在单场景内提供完整、可执行的角色动画。"
      }
    ],
    "optional_creative_guidance": [
      "高动态不等于所有部位同时无序运动；应以情绪目标驱动面部、头部、四肢、躯干和重心按因果顺序协同。",
      "道具描述至少包含连接点、受力来源、运动方向、形变或摆动、对角色的反作用和最终衰减状态。",
      "背景活化只选择场景中真实存在且可合理运动的元素，避免凭空添加人群、车辆或天气事件。",
      "每次硬切后重新建立该场景的地标、角色站位、摄影机方向和主动作，不依赖上一段的模糊延续。",
      "用户要求克制、庄重或静止时，降低动作幅度但保留清晰表演意图、环境响应和可见停止状态。"
    ]
  }
}
